{
  "schema_version": "1.0",
  "transition_id": "PROJECT-LEADER-INTERNAL-OPERATION-LIVENESS-048R-MERGE",
  "task_id": "PROJECT-LEADER-INTERNAL-OPERATION-LIVENESS-048R",
  "repository": "martaxi-boss/Project-leader",
  "terminal_status": "SUCCESS",
  "authorization_record": ".project-leader/transitions/PROJECT-LEADER-INTERNAL-OPERATION-LIVENESS-048R-MERGE.authorization.json",
  "action": "merge_to_main",
  "target": {
    "kind": "pull_request",
    "identifier": "#48",
    "revision": "0af65bdc871c7b3b1591e7659bfbc0df9486d4ca",
    "base_revision": "05225695684b54ce5becbb89cf0e5b6dc88dcafa",
    "environment": null
  },
  "observed_at": "2026-10-04T11:21:00Z",
  "final_state": {
    "status": "MERGED",
    "revision": "7d89c6b9f99128dbb04a9cfd926cd04aa1210f73"
  },
  "evidence": [
    "Immediately before merge, PR #48 was open and mergeable at exact head 0af65bdc871c7b3b1591e7659bfbc0df9486d4ca on exact main base 05225695684b54ce5becbb89cf0e5b6dc88dcafa.",
    "Implementation head 92e2c1ae5c168586f09e208efef9066d0ad7ea8f passed Control contract tests 37198180187, Validate control plane 37198179973 and Package ChatGPT plugins 37198180040.",
    "The only changes from implementation head to final PR head were task-local Worker Result and trust-root transition-result evidence.",
    "Final PR head 0af65bdc871c7b3b1591e7659bfbc0df9486d4ca passed Trusted authorization gate 37198312516, Control contract tests 37198314089, Validate control plane 37198314077 and Package ChatGPT plugins 37198314130.",
    "GitHub merged PR #48 with expected_head_sha enforcement and returned merge commit 7d89c6b9f99128dbb04a9cfd926cd04aa1210f73; fresh verification shows main at that exact SHA and PR #48 closed/merged."
  ],
  "residual_blockers": []
}
