{
  "schema_version": "1.0",
  "transition_id": "PROJECT-LEADER-CANONICAL-RUNTIME-BOOTSTRAP-056R-MERGE",
  "task_id": "PROJECT-LEADER-CANONICAL-RUNTIME-BOOTSTRAP-056R",
  "repository": "martaxi-boss/Project-leader",
  "terminal_status": "SUCCESS",
  "authorization_record": ".project-leader/transitions/PROJECT-LEADER-CANONICAL-RUNTIME-BOOTSTRAP-056R-MERGE.authorization.json",
  "action": "merge_to_main",
  "target": {
    "kind": "pull_request",
    "identifier": "#57",
    "revision": "6492e35ca616d561474239c1eedb4730cc3203bf",
    "base_revision": "a2f7d8e207b979095f1866d9c526002cf5b98b6a",
    "environment": null
  },
  "observed_at": "2026-10-04T12:27:00Z",
  "final_state": {
    "status": "MERGED",
    "revision": "a546481c6612a161dee6fab050a3196988a279a4"
  },
  "evidence": [
    "Durable exact-revision merge authorization commit 58fbce141d00535b4c44cc8d2e306eb05d5fb2df existed before the merge effect.",
    "Immediately before merge, PR #57 was open and mergeable at exact head 6492e35ca616d561474239c1eedb4730cc3203bf on exact main base a2f7d8e207b979095f1866d9c526002cf5b98b6a.",
    "Implementation head 19a34788200c12442d7acc02c62c710f69cef9e9 passed Control contract tests 37201929285, Validate control plane 37201929235 and Package ChatGPT plugins 37201929241.",
    "Final PR head 6492e35ca616d561474239c1eedb4730cc3203bf passed Trusted authorization gate 37202027714, Control contract tests 37202030242, Validate control plane 37202030235 and Package ChatGPT plugins 37202030271.",
    "GitHub merge API executed with expected_head_sha 6492e35ca616d561474239c1eedb4730cc3203bf and returned merge commit a546481c6612a161dee6fab050a3196988a279a4; fresh verification showed main at that exact SHA.",
    "Post-merge Control contract tests 37202095570, Validate control plane 37202095585, Package ChatGPT plugins 37202095559 and Repository hygiene 37202095636 all completed SUCCESS."
  ],
  "residual_blockers": []
}
