{
  "schema_version": "1.0",
  "transition_id": "PROJECT-LEADER-POST-MERGE-HYGIENE-072-MERGE",
  "task_id": "PROJECT-LEADER-POST-MERGE-HYGIENE-072",
  "repository": "martaxi-boss/Project-leader",
  "terminal_status": "SUCCESS",
  "authorization_record": ".project-leader/transitions/PROJECT-LEADER-POST-MERGE-HYGIENE-072-MERGE.authorization.json",
  "action": "merge_to_main",
  "target": {
    "kind": "pull_request",
    "identifier": "https://github.com/martaxi-boss/Project-leader/pull/74",
    "revision": "bc31c0a636a454d47a5539cee242f99f1fbccf4a",
    "base_revision": "1760cf8a80c3df7c1f3296053b55ef6f9716ca8a",
    "environment": null
  },
  "observed_at": "2026-10-06T19:08:00Z",
  "final_state": {
    "status": "MERGED",
    "revision": "1a6f38a089becbd2dedb2f760eb13f30f9435b25"
  },
  "evidence": [
    "Exact pre-effect STANDING_OWNER_GRANT merge authorization was durably committed on control/merge-authorization-072 at ed32e72fd1e4e99e24ca83deb36d3bf032fb61c8 before the merge.",
    "PR 74 was revalidated immediately before the effect at exact head bc31c0a636a454d47a5539cee242f99f1fbccf4a and exact base 1760cf8a80c3df7c1f3296053b55ef6f9716ca8a, then GitHub merged it as 1a6f38a089becbd2dedb2f760eb13f30f9435b25.",
    "Post-main Control contract tests 37516513942, Validate control plane 37516513835, Package ChatGPT plugins 37516513843, and Repository hygiene 37516513825 all completed SUCCESS.",
    "Fresh branch inventory after the successful hygiene sweep contains only main and control/merge-authorization-072. The five exactly authorized stale refs and the merged Builder branch are absent; zero open pull requests remain."
  ],
  "residual_blockers": []
}
