{
  "schema_version": "1.0",
  "transition_id": "PROJECT-LEADER-SUPERSEDED-BRANCH-PURGE-029-DELETE-006",
  "task_id": "PROJECT-LEADER-SUPERSEDED-BRANCH-PURGE-029",
  "repository": "martaxi-boss/Project-leader",
  "terminal_status": "SUCCESS",
  "authorization_record": ".project-leader/transitions/PROJECT-LEADER-SUPERSEDED-BRANCH-PURGE-029-DELETE-006.authorization.json",
  "action": "delete_owner_authorized_superseded_non_main_branch_refs",
  "target": {
    "kind": "repository_branch",
    "identifier": "builder/trusted-gate-e2e-007",
    "revision": "9edf7f359856ceb71b6b7cfc203a7221fcb249e6",
    "base_revision": "0552f77947bc50943f313540bda58a25d22fe8eb",
    "environment": null
  },
  "observed_at": "2026-10-03T13:37:29.625Z",
  "final_state": {
    "status": "DELETED",
    "revision": null
  },
  "evidence": [
    "Durable exact-revision Owner authorization existed for builder/trusted-gate-e2e-007 @ 9edf7f359856ceb71b6b7cfc203a7221fcb249e6 before deletion.",
    "Repository hygiene run 37126726675 completed SUCCESS after PR #30 merged.",
    "Repository hygiene push run 37126726810 completed SUCCESS on the merged main state.",
    "Live GitHub branch listing after the purge no longer contained builder/trusted-gate-e2e-007; only main remained."
  ],
  "residual_blockers": []
}
