{
  "schema_version": "1.0",
  "transition_id": "PROJECT-LEADER-STALE-BASE-STATUS-FIX-092-MERGE",
  "task_id": "PROJECT-LEADER-STALE-BASE-STATUS-FIX-092",
  "repository": "martaxi-boss/Project-leader",
  "terminal_status": "SUCCESS",
  "authorization_record": ".project-leader/transitions/PROJECT-LEADER-STALE-BASE-STATUS-FIX-092-MERGE.authorization.json",
  "action": "merge_to_main",
  "target": {
    "kind": "pull_request",
    "identifier": "https://github.com/martaxi-boss/Project-leader/pull/95",
    "revision": "cfc6a709abcd9f28c442a51b83ca74ba70876f64",
    "base_revision": "9a2ca8e6fb47fe7341d15c2ed4b580cd517af22b",
    "environment": null
  },
  "observed_at": "2026-10-07T15:47:41Z",
  "final_state": {
    "status": "MERGED",
    "revision": "0f1fb5d9aaf9f171c843937e482fcdf75edd7482"
  },
  "evidence": [
    "Exact merge authorization was durably committed on control/merge-authorization-092 at 59af5091399aaf9c5a4db4ac52967df4f4f63b52 before PR 95 merged.",
    "GitHub records PR 95 merged and canonical main advanced to 0f1fb5d9aaf9f171c843937e482fcdf75edd7482.",
    "Post-main runs 37646721412 Control contract tests, 37646721248 Validate control plane, 37646721221 Package ChatGPT plugins, and 37646721363 Repository hygiene all completed SUCCESS."
  ],
  "residual_blockers": []
}
