{
  "schema_version": "1.0",
  "transition_id": "PROJECT-LEADER-AUTONOMY-033-TRUST-ROOT",
  "task_id": "PROJECT-LEADER-AUTONOMY-033",
  "repository": "martaxi-boss/Project-leader",
  "terminal_status": "SUCCESS",
  "authorization_record": ".project-leader/transitions/PROJECT-LEADER-AUTONOMY-033-TRUST-ROOT.authorization.json",
  "action": "trust_root_mutation",
  "target": {
    "kind": "repository_branch",
    "identifier": "builder/project-leader-autonomy-033",
    "revision": "0d0641b85132b87b59adb65f13f6f62e921a6d22",
    "base_revision": "73c5512674b2f14d82d69f6f4a10a8f886cf0049",
    "environment": null
  },
  "observed_at": "2026-10-03T17:13:00Z",
  "final_state": {
    "status": "MUTATED",
    "revision": "8de76dd32ed0fba008448262328966c4238857fd"
  },
  "evidence": [
    "Owner narrowed the architecture before the clean implementation: Project Leader is its own project and PR #32 was closed unmerged because it mixed other project policies.",
    "Trust-root authorization was durably persisted before substantive protected-file mutation at commit 3e6fa7772fd64f553ef9190986a2cc8d5424d4c9.",
    "Implementation head 8de76dd32ed0fba008448262328966c4238857fd passed Control contract tests run 37139633722.",
    "Implementation head 8de76dd32ed0fba008448262328966c4238857fd passed Validate control plane run 37139633615.",
    "Implementation head 8de76dd32ed0fba008448262328966c4238857fd passed Package ChatGPT plugins run 37139633672.",
    "PINK IPTV, FADEGO and VCAM-PRO policy blobs are byte-identical between main and the task branch."
  ],
  "residual_blockers": []
}
