{
  "schema_version": "1.0",
  "transition_id": "PROJECT-LEADER-AUDIT-REMEDIATION-P2-079-MERGE-83",
  "task_id": "PROJECT-LEADER-AUDIT-REMEDIATION-P2-079",
  "repository": "martaxi-boss/Project-leader",
  "terminal_status": "SUCCESS",
  "authorization_record": ".project-leader/transitions/PROJECT-LEADER-AUDIT-REMEDIATION-P2-079-MERGE-83.authorization.json",
  "action": "merge_to_main",
  "target": {
    "kind": "pull_request",
    "identifier": "https://github.com/martaxi-boss/Project-leader/pull/83",
    "revision": "5e2d6a061df8757e9f8f758e50439982908bb2f1",
    "base_revision": "1fa8ace2627bedf5d9aa77f8525de9bc76d25204",
    "environment": null
  },
  "observed_at": "2026-10-07T10:40:00Z",
  "final_state": {
    "status": "MERGED",
    "revision": "4e3a6094a77000ec3089bcd86fa3a59484acdd23"
  },
  "evidence": [
    "PR 83 merged at exact authorized head 5e2d6a061df8757e9f8f758e50439982908bb2f1 into exact authorized base 1fa8ace2627bedf5d9aa77f8525de9bc76d25204.",
    "Final PR-head checks were terminal-success before merge: Trusted authorization gate 37608642581, Control contract tests 37608646313, Validate control plane 37608646353, Package ChatGPT plugins 37608646289.",
    "Merge commit is 4e3a6094a77000ec3089bcd86fa3a59484acdd23."
  ],
  "residual_blockers": []
}
