{
  "schema_version": "1.0",
  "transition_id": "PROJECT-LEADER-NONINTERACTIVE-FALLBACK-HYGIENE-044-DELETE-042-CONTROL",
  "task_id": "PROJECT-LEADER-NONINTERACTIVE-FALLBACK-HYGIENE-044",
  "repository": "martaxi-boss/Project-leader",
  "terminal_status": "SUCCESS",
  "authorization_record": ".project-leader/transitions/PROJECT-LEADER-NONINTERACTIVE-FALLBACK-HYGIENE-044-DELETE-042-CONTROL.authorization.json",
  "action": "delete_owner_authorized_superseded_non_main_branch_refs",
  "target": {
    "kind": "repository_branch",
    "identifier": "control/merge-authorization-042",
    "revision": "108941b2f83d4893ca2bd303ff399f3966f2890f",
    "base_revision": "80288f44a236c0ca4095bf4399492632e0152dbe",
    "environment": null
  },
  "observed_at": "2026-10-04T02:18:00Z",
  "final_state": {
    "status": "DELETED",
    "revision": null
  },
  "evidence": [
    "Task 044 merged the unique task-042 MERGE authorization/result and prior DELETE-041-CONTROL result into canonical main before cleanup.",
    "Repository hygiene run 37170555209 completed successfully on main merge SHA 7dc5aa8cb86ed0a473c5e95fab4cd40f6eab7875.",
    "Fresh branch inventory after the hygiene run contains only main and control/merge-authorization-044; control/merge-authorization-042 is absent."
  ],
  "residual_blockers": []
}
