{
  "schema_version": "1.0",
  "transition_id": "PROJECT-LEADER-SUPERSEDED-BRANCH-PURGE-029-DELETE-001",
  "task_id": "PROJECT-LEADER-SUPERSEDED-BRANCH-PURGE-029",
  "repository": "martaxi-boss/Project-leader",
  "terminal_status": "SUCCESS",
  "authorization_record": ".project-leader/transitions/PROJECT-LEADER-SUPERSEDED-BRANCH-PURGE-029-DELETE-001.authorization.json",
  "action": "delete_owner_authorized_superseded_non_main_branch_refs",
  "target": {
    "kind": "repository_branch",
    "identifier": "builder/ci-dispatch-dedup-021",
    "revision": "6e0b74b8b83031f1570c53356564fd76cc6a5ca2",
    "base_revision": "0552f77947bc50943f313540bda58a25d22fe8eb",
    "environment": null
  },
  "observed_at": "2026-10-03T13:37:29.625Z",
  "final_state": {
    "status": "DELETED",
    "revision": null
  },
  "evidence": [
    "Durable exact-revision Owner authorization existed for builder/ci-dispatch-dedup-021 @ 6e0b74b8b83031f1570c53356564fd76cc6a5ca2 before deletion.",
    "Repository hygiene run 37126726675 completed SUCCESS after PR #30 merged.",
    "Repository hygiene push run 37126726810 completed SUCCESS on the merged main state.",
    "Live GitHub branch listing after the purge no longer contained builder/ci-dispatch-dedup-021; only main remained."
  ],
  "residual_blockers": []
}
